[
  {
    "id": "azdo:9876",
    "provider": "azdo",
    "url": "https://dev.azure.com/example/proj/_git/repo/pullrequest/1234?discussionId=9876",
    "status": "active",
    "file": "src/auth.ts",
    "line": 42,
    "original_line": 40,
    "anchor_lost": false,
    "first_comment": {
      "author": "alice",
      "created_at": "2026-04-22T14:30:00Z",
      "body": "This should handle null values — what if user.session is undefined?"
    },
    "replies": [
      {
        "author": "leo",
        "created_at": "2026-04-22T15:10:00Z",
        "body": "Good point, what about session being undefined?"
      }
    ],
    "is_bot": false,
    "is_outdated": false,
    "raw_status": "active"
  },
  {
    "id": "azdo:9881",
    "provider": "azdo",
    "url": "https://dev.azure.com/example/proj/_git/repo/pullrequest/1234?discussionId=9881",
    "status": "active",
    "file": "src/handlers/login.ts",
    "line": 118,
    "original_line": 118,
    "anchor_lost": true,
    "first_comment": {
      "author": "bob",
      "created_at": "2026-04-23T09:12:00Z",
      "body": "Why are we re-throwing here?"
    },
    "replies": [],
    "is_bot": false,
    "is_outdated": false,
    "raw_status": "active"
  },
  {
    "id": "azdo:9890",
    "provider": "azdo",
    "url": "https://dev.azure.com/example/proj/_git/repo/pullrequest/1234?discussionId=9890",
    "status": "active",
    "file": "src/utils/parse.ts",
    "line": 14,
    "original_line": 14,
    "anchor_lost": false,
    "first_comment": {
      "author": "dependabot[bot]",
      "created_at": "2026-04-24T03:01:00Z",
      "body": "Vulnerable dep flagged."
    },
    "replies": [],
    "is_bot": true,
    "is_outdated": false,
    "raw_status": "active"
  },
  {
    "id": "azdo:9891",
    "provider": "azdo",
    "url": "https://dev.azure.com/example/proj/_git/repo/pullrequest/1234?discussionId=9891",
    "status": "pending",
    "file": "src/utils/parse.ts",
    "line": 30,
    "original_line": 30,
    "anchor_lost": false,
    "first_comment": {
      "author": "alice",
      "created_at": "2026-04-22T11:00:00Z",
      "body": "Add a comment explaining why."
    },
    "replies": [],
    "is_bot": false,
    "is_outdated": false,
    "raw_status": "pending"
  },
  {
    "id": "azdo:9892",
    "provider": "azdo",
    "url": "https://dev.azure.com/example/proj/_git/repo/pullrequest/1234?discussionId=9892",
    "status": "resolved",
    "file": "src/utils/parse.ts",
    "line": 45,
    "original_line": 45,
    "anchor_lost": false,
    "first_comment": {
      "author": "alice",
      "created_at": "2026-04-22T11:30:00Z",
      "body": "Typo in the docstring."
    },
    "replies": [],
    "is_bot": false,
    "is_outdated": false,
    "raw_status": "fixed"
  }
]
